{
  "schema": "run-manifest/v1",
  "run_id": "20260720232649-dea3d309",
  "stage": "verify",
  "status": "passed",
  "started_at": "2026-07-20T23:26:49Z",
  "finished_at": "2026-07-20T23:26:49.484Z",
  "duration_ms": 484,
  "git": {
    "repo": true,
    "branch": "develop",
    "head_sha": "8a3eb847a7a96832a7fe4309595da284f2131ad8",
    "dirty": true,
    "changed_files": [
      ".forge/HANDOFF.md",
      ".forge/product/current/adr/0002-authz-observability-substrate.md",
      ".forge/product/current/adr/README.md",
      ".forge/specs/active/security-observability-gates/",
      "CHANGELOG.md",
      "template/.forge/FORGE.md",
      "template/.forge/constitution.md",
      "template/.forge/hooks/git/pre-push",
      "template/.forge/rules/README.md",
      "template/.forge/rules/architecture/authz-pdp-pep.md",
      "template/.forge/rules/architecture/jwt-permissions.md",
      "template/.forge/rules/architecture/observability.md",
      "template/.forge/rules/architecture/pii-pci-classification.md",
      "template/.forge/schemas/alerts-as-code.schema.json",
      "template/.forge/schemas/authz-map.schema.json",
      "template/.forge/schemas/data-classification.schema.json",
      "template/.forge/schemas/forge.schema.json",
      "template/.forge/schemas/graph.schema.json",
      "template/.forge/schemas/spec-manifest.schema.json",
      "template/.forge/scripts/check-authz.sh",
      "template/.forge/scripts/check-observability.sh",
      "template/.forge/scripts/lib/check-authz.mjs",
      "template/.forge/scripts/lib/check-data-governance.mjs",
      "template/.forge/scripts/lib/check-observability.mjs",
      "template/.forge/scripts/lib/gate-mode.mjs",
      "template/.forge/scripts/lib/graph-build.mjs",
      "template/.forge/scripts/lib/graph-govern.mjs",
      "template/.forge/scripts/lib/source-scan.mjs",
      "template/.forge/scripts/lib/validate-spec.mjs",
      "template/.forge/scripts/lib/yaml-lite.mjs",
      "template/.forge/scripts/spec-verify.sh",
      "template/.forge/templates/FORGE.md",
      "template/.forge/templates/spec/requirements.md",
      "tests/check-authz-gate.sh",
      "tests/check-observability-gate.sh",
      "tests/fixtures/authz/",
      "tests/fixtures/data-governance/",
      "tests/fixtures/governance-schemas/",
      "tests/fixtures/observability/",
      "tests/gate-mode-gate.sh",
      "tests/graph-govern-gate.sh",
      "tests/req12-pii-log-gate.sh",
      "tests/req13-affects-surfaces-gate.sh",
      "tests/w20-spec-gate.sh",
      "tests/w30-schemas-gate.sh",
      "tests/w41-graph-gate.sh",
      "tests/w90-run-manifest-gate.sh",
      "tests/yaml-lite-gate.sh"
    ],
    "diff_stat": ".forge/HANDOFF.md                                  |  12 +--\n .forge/product/current/adr/README.md               |   1 +\n CHANGELOG.md                                       |  14 +++\n template/.forge/FORGE.md                           |   1 +\n template/.forge/constitution.md                    |  11 +-\n template/.forge/hooks/git/pre-push                 |  21 ++++\n template/.forge/rules/README.md                    |   8 +-\n .../.forge/rules/architecture/jwt-permissions.md   |  15 ++-\n .../.forge/rules/architecture/observability.md     |  56 ++++++++++-\n template/.forge/schemas/forge.schema.json          |  23 ++++-\n template/.forge/schemas/graph.schema.json          |  11 +-\n template/.forge/schemas/spec-manifest.schema.json  |   5 +\n .../.forge/scripts/lib/check-data-governance.mjs   | 112 ++++++++++++++++-----\n template/.forge/scripts/lib/graph-build.mjs        |  60 ++++++++++-\n template/.forge/scripts/lib/validate-spec.mjs      |  40 ++++++++\n template/.forge/scripts/lib/yaml-lite.mjs          |  19 +++-\n template/.forge/scripts/spec-verify.sh             |  19 ++++\n template/.forge/templates/FORGE.md                 |   1 +\n template/.forge/templates/spec/requirements.md     |  41 ++++++++\n tests/w20-spec-gate.sh                             |  75 ++++++++++++++\n tests/w30-schemas-gate.sh                          |  16 +++\n tests/w41-graph-gate.sh                            |  61 +++++++++++\n tests/w90-run-manifest-gate.sh                     |  19 ++++\n 23 files changed, 595 insertions(+), 46 deletions(-)",
    "diff_sha256": "0eaa983c4d3aa43d6b45e7dbaa0c8e5d2234d90dcdd31c4b60d80629532d353e"
  },
  "inputs": [
    {
      "path": "manifest.yaml",
      "exists": true,
      "sha256": "a8a3eb2d6ad0b775ad246c76810a9850820228683ec58b0548aa00845fcfba44",
      "bytes": 940,
      "kind": "file"
    },
    {
      "path": "tasks.md",
      "exists": true,
      "sha256": "a10f9b05ff36efc030de1015540bf4e3b8095c0e92b6239479ddd9e6424c3b56",
      "bytes": 9213,
      "kind": "file"
    },
    {
      "path": "traceability.yaml",
      "exists": false,
      "sha256": null,
      "bytes": null
    }
  ],
  "commands": [
    {
      "name": "spec-verify",
      "command": "spec-verify.sh security-observability-gates",
      "status": "passed"
    }
  ],
  "outputs": [
    {
      "path": "verification.yaml",
      "exists": true,
      "sha256": "bfd70232aec74983e89a536a958406f6d0c6a143c1c8dcb0ca6cc3a32a2853a7",
      "bytes": 218,
      "kind": "file"
    }
  ],
  "runner": {
    "name": "local",
    "profile": "standard"
  },
  "budgets": {
    "profile": "standard",
    "budget_class": "medium",
    "expected_runs": 1,
    "estimated_timeout_s": 300,
    "uses_llm": false,
    "uses_subagent": false
  }
}
